{
  "schema": "panel",
  "role": "design-critic",
  "run": "20261016-125619-audit-standard",
  "agent": "critic-1",
  "model": "claude-opus-5-5",
  "isolation": "subagent",
  "packet_hash": "882193bc45860795",
  "inventory": [
    {"screen": "when (/)", "shots": ["root/default/375-light", "root/slot-chosen/1280-light"], "content": "Masthead (bin icon, council name, two nav links); 'Book a slot' title, one-line intro, text step indicator; day buttons Today/Tomorrow/Saturday 17/Sunday 18 + 'Another day' link; 'Slots' heading with date repeated twice; an unlabelled group of 'Few left' slots, then Morning and Afternoon grids with 'Full' tiles greyed; green Next; 'Opening days' card; footer.", "eye_order": ["'Book a slot' title", "the slot grid as a mass, especially the amber 'Few left' tags", "Next button"], "primary_action": "Next", "memorable": "The amber 'Few left' tags are the only colour that pulls; nothing else memorable."},
    {"screen": "vehicle", "shots": ["vehicle/van/375-dark", "vehicle/info-open/1280-light"], "content": "Back link, title, steps; Vehicle segmented choices with a separate circled-i info button; permit field when Van chosen; 'What are you bringing?' with seven bordered checkbox rows carrying the limits; Next.", "eye_order": ["title", "vehicle choices", "checkbox stack"], "primary_action": "Next", "memorable": "none"},
    {"screen": "confirm", "shots": ["confirm/default/1280-light", "confirm/errors/375-light"], "content": "Title, steps; 'Your booking' summary card with change links; four labelled inputs with hints; 'Nothing is paid' line; Book this slot. Error state: red-bordered summary with linked messages, inline red messages.", "eye_order": ["title", "booking summary card", "Book this slot"], "primary_action": "Book this slot", "memorable": "none; the error summary is well done"},
    {"screen": "done", "shots": ["done/default/375-dark", "done/default/1440-light"], "content": "'Booked' title; card with 'Your reference' and DR-204117 in large bold; 'At the centre' card of instructions; outline 'Book another slot' button.", "eye_order": ["Booked", "DR-204117", "At the centre text"], "primary_action": "none (read)", "memorable": "The reference set large - the one typographic moment in the flow."}
  ],
  "tests": {
    "swap": {"result": "fail", "evidence": "Visually, a library room booking or a GP appointment flow could use these screens unchanged with words swapped: bordered white cards on pale grey, one green filled button, numbered step text, bold sans headings. What is specific (Few left/Full slot tags, rules beside controls, permit field, gate reference) is content and structure, not visual design."},
    "category_guess": {"result": "fail", "evidence": "From 'UK council booking service' alone one would predict exactly this: public-sector form kit look, green accent, bordered inputs, underlined links, error summary with linked messages."},
    "similar_prompt": {"result": "fail", "evidence": "A similar brief to a capable generator would land very close: same card-on-grey layout, same step indicator, same slot grid of bordered tiles. The care shown in copy (limits in labels, 'Nothing is paid') is the only thing a generic result would likely miss."}
  },
  "verdict": {
    "value": "partly_specific",
    "evidence": [
      "Specific content structure: 20-minute slot tiles with Few left/Full tags, rules beside controls ('Rubble (up to four bags)', 'Starts DRC-, then five digits'), permit field only for Van, done page around the gate reference.",
      "Generic visual layer: stock public-sector form kit; the only identity marks are the council name and a small bin icon in the masthead."
    ]
  },
  "verdict_at": "2026-10-16T13:20:00Z",
  "unsealed_at": "2026-10-16T17:05:36.129Z",
  "appeal": {
    "value": "plain",
    "unfinished": [
      "No focal point at the first viewport of 'when'; title, intro, steps and day buttons carry similar weight (root/default/375-light).",
      "Identity is only the council name in bold text plus a small bin icon.",
      "Done page at 1440 is two boxes and an outline button; the footer band stops above an empty grey band (done/default/1440-light).",
      "Slot grid stops at ~816px while the Opening days card spans the full column (root/slot-chosen/1280-light).",
      "Info button stranded on its own row under the vehicle choices at 375 (vehicle/van/375-dark).",
      "Headings differ from body mainly in size and weight; the slot area reads as a document outline."
    ],
    "evidence": [
      "Clean, legible and consistent across 375/1280/1440 and light/dark; nothing broken or clashing.",
      "Nothing worth looking at beyond the form: council green used only on buttons and selected states; the screen shown at the gate is bare text in boxes.",
      "For an Operate surface this plainness is close to correct, but it misses 'plain, not bare' on the done page and the 'when' first viewport."
    ]
  },
  "brand_fit": {
    "attributes": [
      {"is": "civic", "not": "corporate", "x_visible": true, "y_avoided": true, "evidence": "Council name in masthead, plain public-service register, phone number and address in footer, no marketing language or stock imagery. Civic in the sense of a public form; little that says Dunmore specifically."},
      {"is": "plain", "not": "bare", "x_visible": true, "y_avoided": false, "evidence": "Plain throughout. Bare on done (two boxes, no day/slot/vehicle shown, short page with empty band at 1440) and on the 'when' first viewport where nothing leads."},
      {"is": "firm about the rules", "not": "stern", "x_visible": true, "y_avoided": true, "evidence": "Rules sit beside the controls they govern: limits in checkbox labels, permit hint 'Starts DRC-, then five digits', 'Nothing is paid. Bring the reference and something with your address on it.' Error messages are specific and calm ('Enter a Dunmore district postcode, which starts DN'); red only for errors."}
    ],
    "overall": "partly"
  },
  "mode_fit": {"result": "fits", "evidence": "All four surfaces are Operate/Read and stay quiet and conventional: one filled button per step, standard inputs, no motion beyond the declared budget. The done (Read) surface could carry more emphasis on the gate information without breaking mode."},
  "rubric": {
    "specificity": {"score": 2, "evidence": "Content and rules are specific to this centre; visual layer would pass for any council form (swap and category tests fail)."},
    "hierarchy": {"score": 2, "evidence": "Confirm and done have clear primary/secondary/tertiary. On 'when' the unlabelled Few left group competes with and precedes Morning/Afternoon, breaking chronological reading; the repeated date lines add noise; the first viewport has no leading element."},
    "coherence": {"score": 3, "evidence": "One type family, one green, 4px radius and borders-not-shadows used consistently across all routes and both themes; selected states use the same tint everywhere."},
    "restraint": {"score": 3, "evidence": "One filled button per step, red only for errors, amber only for scarcity. Restraint has left no single boldness anywhere except the reference number."},
    "brand_fit": {"score": 2, "evidence": "Civic and firm-not-stern met; plain-not-bare missed on done and on the slot page opening."},
    "execution": {"score": 2, "evidence": "Inputs, error summary and checkbox rows are tidy. Weak spots: slot grid width vs full-width card, stranded info button at 375, 'Back to the slots' link crowding the title, date stated twice under Slots, short done page leaving empty band, weak selected-state contrast on day buttons and the chosen slot."},
    "appeal": {"score": 1, "evidence": "Clean but bare; a resident would find it usable, not cared for. See appeal verdict."}
  },
  "detector_comparison": {
    "detector_hits": 0,
    "agreements": [],
    "detector_only": [],
    "critic_only": ["out-of-order Few left grouping", "done page missing day and slot", "uneven band widths on 'when'", "stranded info button at 375", "no focal point / identity only in masthead"],
    "likely_false_positives": [],
    "note": "Detectors returned no hits; nothing to reconcile. Verdicts unchanged."
  },
  "findings": [
    {
      "id": "critic-1-01",
      "title": "'Few left' slots are pulled out of time order into an unlabelled group above Morning and Afternoon",
      "description": "On 'when', every slot tagged 'Few left' is shown in a separate, unheaded block before the Morning and Afternoon grids. On Saturday the Morning grid reads 08:00, 09:20, 10:00, 11:00... with 08:20, 08:40, 09:00, 09:40, 10:20, 10:40 missing from it, because they sit in the block above. The same split happens at 375 (Monday: Morning starts 08:00, 08:40 Full, 09:00 while 08:20 and 09:20 are above).",
      "problem_type": "multiple_locations",
      "criteria": [{"kind": "design", "id": "DES-hierarchy", "primary": true}],
      "impact": "Residents scanning for 'Saturday morning' read the Morning grid as the whole morning and see gaps where free slots exist.",
      "locations": [
        {"route": "/", "state": "slot-chosen", "viewport": {"width": 1280}, "theme": "light", "crop": "screens/root/slot-chosen/1280-light.png", "bbox": [96, 509, 720, 290]},
        {"route": "/", "state": "default", "viewport": {"width": 375}, "theme": "light", "crop": "screens/root/default/375-light.png"}
      ],
      "evidence": [{"type": "screenshot", "ref": "screens/root/slot-chosen/1280-light.png", "detail": "Morning grid 08:00, 09:20, 10:00, 11:00 Full...; 08:20-10:40 shown in the block above with no heading"}],
      "found_by": [{"role": "design-critic", "agent": "critic-1", "model": "claude-opus-5-5", "method": "critic"}],
      "recommendation": "Decide whether scarcity or time is the organising order; if time, keep every slot in its Morning/Afternoon position and let the Few left tag mark scarcity in place.",